[
  {
    "id": "000531",
    "source_type": "synthetic",
    "text": "派出所刚发提醒了，先交认证金的退款别信",
    "context": {
      "title": "广告诈骗导流普通用户转述正常场景",
      "description": "",
      "time": "",
      "topic": "广告诈骗导流"
    },
    "risk_level": "none",
    "encoding_primary": "none",
    "encoding_secondary": [],
    "ambiguity": "low",
    "evidence_strength": "weak",
    "hard_negative": true,
    "reasoning": {
      "literal_analysis": [
        "文本表面是转发派出所的反诈提醒：要求先交认证金的退款都不要相信。"
      ],
      "encoding_analysis": [
        "上下文明确提供正常用途或反风险目的，未形成稳定风险编码。"
      ],
      "context_analysis": [
        "无明确上下文；按文本本身和常见语用判断。"
      ],
      "supporting_evidence": [],
      "counter_evidence": [
        "文本没有招揽、交易、攻击、规避或现实动员意图。",
        "普通语境和反证完整。"
      ],
      "final_rationale": "文本提供完整反证，判为 none。"
    },
    "quality_status": "needs_revision",
    "review_notes": "source=phase3_second_wave; batch=phase3_v2_long_tail_boundaries; category=spam_ads_fraud; contrast_mode=safe_context; cluster=spam_ads_fraud_safe_context_w2; merged_processed; needs_human_review",
    "needs_context": false,
    "split": "validation"
  },
  {
    "id": "000532",
    "source_type": "synthetic",
    "text": "正规兼职结算不会要求员工代收陌生资金",
    "context": {
      "title": "广告诈骗导流普通用户转述正常场景",
      "description": "",
      "time": "",
      "topic": "广告诈骗导流"
    },
    "risk_level": "none",
    "encoding_primary": "none",
    "encoding_secondary": [],
    "ambiguity": "low",
    "evidence_strength": "weak",
    "hard_negative": true,
    "reasoning": {
      "literal_analysis": [
        "文本表面是说明正规兼职结算不会要求员工代收陌生来源的资金。"
      ],
      "encoding_analysis": [
        "上下文明确提供正常用途或反风险目的，未形成稳定风险编码。"
      ],
      "context_analysis": [
        "无明确上下文；按文本本身和常见语用判断。"
      ],
      "supporting_evidence": [],
      "counter_evidence": [
        "文本没有招揽、交易、攻击、规避或现实动员意图。",
        "普通语境和反证完整。"
      ],
      "final_rationale": "文本提供完整反证，判为 none。"
    },
    "quality_status": "needs_revision",
    "review_notes": "source=phase3_second_wave; batch=phase3_v2_long_tail_boundaries; category=spam_ads_fraud; contrast_mode=safe_context; cluster=spam_ads_fraud_safe_context_w2; merged_processed; needs_human_review",
    "needs_context": false,
    "split": "validation"
  },
  {
    "id": "000533",
    "source_type": "synthetic",
    "text": "我妈差点把验证码报出去，还好银行客服拦住了",
    "context": {
      "title": "广告诈骗导流普通用户转述正常场景",
      "description": "",
      "time": "",
      "topic": "广告诈骗导流"
    },
    "risk_level": "none",
    "encoding_primary": "none",
    "encoding_secondary": [],
    "ambiguity": "low",
    "evidence_strength": "weak",
    "hard_negative": true,
    "reasoning": {
      "literal_analysis": [
        "文本表面是分享妈妈差点把验证码报给骗子、幸亏银行客服及时拦截的经历。"
      ],
      "encoding_analysis": [
        "上下文明确提供正常用途或反风险目的，未形成稳定风险编码。"
      ],
      "context_analysis": [
        "无明确上下文；按文本本身和常见语用判断。"
      ],
      "supporting_evidence": [],
      "counter_evidence": [
        "文本没有招揽、交易、攻击、规避或现实动员意图。",
        "普通语境和反证完整。"
      ],
      "final_rationale": "文本提供完整反证，判为 none。"
    },
    "quality_status": "needs_revision",
    "review_notes": "source=phase3_second_wave; batch=phase3_v2_long_tail_boundaries; category=spam_ads_fraud; contrast_mode=safe_context; cluster=spam_ads_fraud_safe_context_w2; merged_processed; needs_human_review",
    "needs_context": false,
    "split": "validation"
  },
  {
    "id": "000534",
    "source_type": "synthetic",
    "text": "学校今天讲的虚假兼职，和这个话术一模一样",
    "context": {
      "title": "广告诈骗导流普通用户转述正常场景",
      "description": "",
      "time": "",
      "topic": "广告诈骗导流"
    },
    "risk_level": "none",
    "encoding_primary": "none",
    "encoding_secondary": [],
    "ambiguity": "low",
    "evidence_strength": "weak",
    "hard_negative": true,
    "reasoning": {
      "literal_analysis": [
        "文本表面是发现学校今天所讲的虚假兼职案例与该诈骗话术完全一致。"
      ],
      "encoding_analysis": [
        "上下文明确提供正常用途或反风险目的，未形成稳定风险编码。"
      ],
      "context_analysis": [
        "无明确上下文；按文本本身和常见语用判断。"
      ],
      "supporting_evidence": [],
      "counter_evidence": [
        "文本没有招揽、交易、攻击、规避或现实动员意图。",
        "普通语境和反证完整。"
      ],
      "final_rationale": "文本提供完整反证，判为 none。"
    },
    "quality_status": "needs_revision",
    "review_notes": "source=phase3_second_wave; batch=phase3_v2_long_tail_boundaries; category=spam_ads_fraud; contrast_mode=safe_context; cluster=spam_ads_fraud_safe_context_w2; merged_processed; needs_human_review",
    "needs_context": false,
    "split": "validation"
  },
  {
    "id": "000535",
    "source_type": "synthetic",
    "text": "退款还是从订单页走吧，私人链接我是不敢点",
    "context": {
      "title": "广告诈骗导流普通用户转述正常场景",
      "description": "",
      "time": "",
      "topic": "广告诈骗导流"
    },
    "risk_level": "none",
    "encoding_primary": "none",
    "encoding_secondary": [],
    "ambiguity": "low",
    "evidence_strength": "weak",
    "hard_negative": true,
    "reasoning": {
      "literal_analysis": [
        "文本表面是表示退款还是通过订单页面走正规流程，不敢点私人发来的链接。"
      ],
      "encoding_analysis": [
        "上下文明确提供正常用途或反风险目的，未形成稳定风险编码。"
      ],
      "context_analysis": [
        "无明确上下文；按文本本身和常见语用判断。"
      ],
      "supporting_evidence": [],
      "counter_evidence": [
        "文本没有招揽、交易、攻击、规避或现实动员意图。",
        "普通语境和反证完整。"
      ],
      "final_rationale": "文本提供完整反证，判为 none。"
    },
    "quality_status": "needs_revision",
    "review_notes": "source=phase3_second_wave; batch=phase3_v2_long_tail_boundaries; category=spam_ads_fraud; contrast_mode=safe_context; cluster=spam_ads_fraud_safe_context_w2; merged_processed; needs_human_review",
    "needs_context": false,
    "split": "validation"
  },
  {
    "id": "000539",
    "source_type": "synthetic",
    "text": "地域名换成车牌首字母，骂起来不容易删",
    "context": {
      "title": "辱骂群体攻击群聊暗号接话",
      "description": "",
      "time": "",
      "topic": "辱骂群体攻击"
    },
    "risk_level": "medium",
    "encoding_primary": "D3_借代",
    "encoding_secondary": [
      "A2_拼音/首字母缩写",
      "D1_反讽"
    ],
    "ambiguity": "medium",
    "evidence_strength": "moderate",
    "hard_negative": false,
    "reasoning": {
      "literal_analysis": [
        "文本表面是教人用车牌首字母代替地域名称来骂人以规避删除。"
      ],
      "encoding_analysis": [
        "主要按 D3_借代 解构，属于辱骂群体攻击的长尾语境。",
        "辅助机制包括：D1_反讽、A2_拼音/首字母缩写。",
        "文本有普通解释，需要结合互动链和行为意图判断。"
      ],
      "context_analysis": [
        "无明确上下文；按文本本身和常见语用判断。"
      ],
      "supporting_evidence": [
        "存在规避直接表达的编码信号。",
        "上下文出现共同理解或私下沟通暗示。"
      ],
      "counter_evidence": [
        "具体目标或行为仍未完全展开，不宜直接判最高风险。"
      ],
      "final_rationale": "存在需要召回的编码或行为信号，但具体链路仍不完整，判为 medium。"
    },
    "quality_status": "needs_revision",
    "review_notes": "source=phase3_second_wave; batch=phase3_v2_long_tail_boundaries; category=insulting_abuse; contrast_mode=obfuscated; cluster=insulting_abuse_obfuscated_w2; merged_processed; needs_human_review",
    "needs_context": false,
    "split": "validation"
  },
  {
    "id": "000540",
    "source_type": "synthetic",
    "text": "那类人统一叫灰头像",
    "context": {
      "title": "辱骂群体攻击群聊暗号接话",
      "description": "",
      "time": "",
      "topic": "辱骂群体攻击"
    },
    "risk_level": "medium",
    "encoding_primary": "D3_借代",
    "encoding_secondary": [
      "A2_拼音/首字母缩写",
      "D1_反讽"
    ],
    "ambiguity": "medium",
    "evidence_strength": "moderate",
    "hard_negative": false,
    "reasoning": {
      "literal_analysis": [
        "文本表面是教人统一用'灰头像'来代称某群体以规避真实名称被检测。"
      ],
      "encoding_analysis": [
        "主要按 D3_借代 解构，属于辱骂群体攻击的长尾语境。",
        "辅助机制包括：D1_反讽、A2_拼音/首字母缩写。",
        "文本有普通解释，需要结合互动链和行为意图判断。"
      ],
      "context_analysis": [
        "无明确上下文；按文本本身和常见语用判断。"
      ],
      "supporting_evidence": [
        "存在规避直接表达的编码信号。",
        "上下文出现共同理解或私下沟通暗示。"
      ],
      "counter_evidence": [
        "具体目标或行为仍未完全展开，不宜直接判最高风险。"
      ],
      "final_rationale": "存在需要召回的编码或行为信号，但具体链路仍不完整，判为 medium。"
    },
    "quality_status": "needs_revision",
    "review_notes": "source=phase3_second_wave; batch=phase3_v2_long_tail_boundaries; category=insulting_abuse; contrast_mode=obfuscated; cluster=insulting_abuse_obfuscated_w2; merged_processed; needs_human_review; voice_fix",
    "needs_context": false,
    "split": "validation"
  },
  {
    "id": "000541",
    "source_type": "synthetic",
    "text": "职业后两个字用表情替掉，大家照样懂",
    "context": {
      "title": "辱骂群体攻击群聊暗号接话",
      "description": "",
      "time": "",
      "topic": "辱骂群体攻击"
    },
    "risk_level": "medium",
    "encoding_primary": "D3_借代",
    "encoding_secondary": [
      "A2_拼音/首字母缩写",
      "D1_反讽"
    ],
    "ambiguity": "medium",
    "evidence_strength": "moderate",
    "hard_negative": false,
    "reasoning": {
      "literal_analysis": [
        "文本表面是教人用表情符号替换职业名称的后两个字来规避审查。"
      ],
      "encoding_analysis": [
        "主要按 D3_借代 解构，属于辱骂群体攻击的长尾语境。",
        "辅助机制包括：D1_反讽、A2_拼音/首字母缩写。",
        "文本有普通解释，需要结合互动链和行为意图判断。"
      ],
      "context_analysis": [
        "无明确上下文；按文本本身和常见语用判断。"
      ],
      "supporting_evidence": [
        "存在规避直接表达的编码信号。",
        "上下文出现共同理解或私下沟通暗示。"
      ],
      "counter_evidence": [
        "具体目标或行为仍未完全展开，不宜直接判最高风险。"
      ],
      "final_rationale": "存在需要召回的编码或行为信号，但具体链路仍不完整，判为 medium。"
    },
    "quality_status": "needs_revision",
    "review_notes": "source=phase3_second_wave; batch=phase3_v2_long_tail_boundaries; category=insulting_abuse; contrast_mode=obfuscated; cluster=insulting_abuse_obfuscated_w2; merged_processed; needs_human_review",
    "needs_context": false,
    "split": "validation"
  },
  {
    "id": "000578",
    "source_type": "synthetic",
    "text": "小区群说去公开听证会提意见，流程挺正常",
    "context": {
      "title": "公共事务普通用户转述正常场景",
      "description": "",
      "time": "",
      "topic": "公共事务"
    },
    "risk_level": "none",
    "encoding_primary": "none",
    "encoding_secondary": [],
    "ambiguity": "low",
    "evidence_strength": "weak",
    "hard_negative": true,
    "reasoning": {
      "literal_analysis": [